Title,Ingredients
Tempe Mendoan Kemangi,"iris tempe--tepung terigu--tepung tapioka--Secukupnya daun kemangi, iris halus--batang daun bawang, rajang halus--lembar daun jeruk, iris halus--buah cabe rawit merah, iris halus--Secukupnya garam--Secukupnya air es--siung bawang putih, haluskan--ketumbar, haluskan--"
Sambel Tempe Kemangi,"g tempe--Secukupnya kemangi--buah cabe merah keriting--buah cabe rawit(sesuai selera)--siung bawang putih--buah bawang merah--kencur--garam--kaldu bubuk--Bahan rendaman:--siung bawang putih, haluskan--Secukupnya garam--Secukupnya air--"
Steak Tempe saus Teriyaki,Bahan :--tempe kotak besar--tepung terigu--sesuai selera Kaldu bubuk--Merica bubuk--biji buncis--buah wortel--siung bawang putih--Margarine--Bahan saus :--sachet saos teriyaki--Saos Sambal--Bawang bombay--secukupnya Gula dan Garam--
Bakso tempe,papan tempe--telor--tepung tapioka--terigu--Royco--
Ayam kecap campur tempe,kl ayam yg sudah digoreng--papan tempe--secukupnya Lada bawang merah--siung Bawang putih--siung Bawang merah--butir Kemiri--secukupnya Kecap bango--
TB (Tumis Teri Tempe Buncis),"secukupnya Buncis--secukupnya Teri--secukupnya Tempe--siung bawang putih, iris tipis--siung bawang merah, iris tipis--buah  Cabe rawit atau sesuai selera--buah cabe merah keriting--secukupnya Garam--secukupnya Lada--secukupnya Penyedap rasa--secukupnya Minyak goreng untuk menumis--"
Bola Bola Tempe Telur,Butir telur puyuh--Papan Tempe--garam--Royco Ayam--Telur ayam--Secukupnya Tepung Panir--Siung Bawang putih--Minyak Goreng--
Naget tempe,papan tempe--telor--royco--Tepung panir--
Oseng Tempe Gembus,"papan tempe gembus,potong dadu--🌶 bahan iris :--siung bawang putih--butir bawang merah--buah cabe rawit--buah tomat--lbr daun salam--kecap manis--saus tiram--btg daun bawang--secukupnya garam,gula pasir--"
Terong Tempe Santan Putih,papan tempe--buah terong ungu--Santan dr kelapa--lembar daun salam--ketumbar bubuk--siung bawang merah iris--siung bawang putih iris--ruas jahe cincang--secukupnya Penyedap--
Steak Tempe Saus Teriyaki,"papan tempe uk.kecil--siung bawang putih, haluskan--sachet beef corned--butir telur--Secukupnya garam, lada--Secukupnya bread crumbs, putih telur utk baluran--Bahan Saus :--siung bawang putih--bawang bombay--saus teriyaki--saus tomat--saus tiram--terigu--Secukupnya air, margarin, oregano--"
Tumis Tempe Telur Puyuh,Papan Tempe--Butir Telur Puyuh--Tangkai Daun Bawang--Buah Cabe Hijau Panjang--Siung Bawang Merah--Siung Bawang Putih--Garam--Pelengkap :--Lembar Daun Salam--Potong Lengkuas--Secukupnya Gula Merah--Secukupnya Gula Pasir--Secukupnya Kecap Manis--Secukupnya Penyedap Rasa--Secukupnya Air--
. Sambel Tempe,Tempe (sesuai selera)--cabe rawit merah--siung bawang putih--siung bawang merah--tomat--garam (secukupnya)--gula--
Nugget Tempeh (Simple & Tasty) Cocok untuk anak-anak,"papan tempe--buah wortel serut halus--tepung terigu--tepung tapioka--Secukupnya garam, kaldu bubuk, dan merica--butir telur--Secukupnya air--Lapisan:--Tepung terigu dicairkan--Tepung panir kasar--"
Oseng Tempe Tahu,papan Tempe--balok Tahu Putih--buah Cabai Kriting--ruas jari Lengkuas--batang Daun Sereh--buah Cabai Rawit--siung Bawang Putih--siung Bawang Merah--secukupnya Minyak--secukupnya Garam--secukupnya Kecap--secukupnya Kaldu--secukupnya Air--
Tempe Sambel Kemangi Pedass 😋🔥,papan Tempe--Beberapa helai Daun Kemangi (cuci)--bj Cabe ijo besar iris--° Bahan Sambal :--bj Cabe rawit--bj Cabe merah keriting--siung Bawang merah--siung Bawang putih--Tomat merah uk.sedang--Terasi bakar (sesuai selera)--Gula pasir (sesuai selera)--Sesuai selera Garam--Gula jawa (sisir/sesuai selera)--
Tempe bacem,"papan tempe,potong setebal cm--Bahan bumbu :--air kelapa--kecap manis--blok gula aren kecil warna pekat,sisir (sesuai selera)--gula pasir--btg sere,keprek--lbr daun salam--lbr daun jeruk--ruas lengkuas,keprek--air asam jawa pekat--secukupnya Garam,merica--bawang merah--siung bawang putih--kemiri--cabe merah keriting (aku skip)--,ketumbar bubuk--"
"Sambal krecek tempe,pedas,gurih,nikmat","papan tempe,goreng sebentar (jangan sampai kering)--secukupnya Udang, potong--secukupnya Kerupuk kulit, goreng,rendam air panas sampai lembut--Cabe rawit merah,sesuai selera--secukupnya Bawang goreng--secukupnya Air santan--btg sereh,keprek--lbr daun salam--lbr daun jeruk--ruas lengkuas,keprek--siung bawang merah--siung bawang putih--ruas jari kencur--cabe merah keriting--secukupnya Garam,gula,lada,kaldu bubuk--"
Ayam dan Tempe Penyet sambal bawang,"ayam, dibagi menjadi bagian--papan tempe, potong-->> bumbu ungkep ayam--siung bawang putih--kunyit--ketumbar--batang daun bawang, iris--penyedap (saya pake royco ayam)--garam--secukupnya Air-->> sambal bawang--siung bawang putih--buah cabe rawit--bks sasa kecil--Sejumput garam--Sejumput gula--Minyak bekas menggoreng ayam--"
Kering tempe kacang,"papan tempe--genggam kacang tanah--buah cabe merah besar--cabe rawit--butir bawang merah--butir bawang putih--grm gula merah--gula pasir--asam jawa--Salam laos, garam minyak secukupnya buat menumis--"
Tempe tepung simple,Tempe skcpnya--bgks tepung bumbu tempe kobe--terigu--tepung beras--Daun bawang--Air sckpnya--Minyak--
Sambal Tempe,potong tempe sedang--siung bawang merah--buah cabai setan--buah tomat merah--Secukupnya garam--Secukupnya merica bubuk--Secukupnya ketumbar bubuk--Secukupnya minyak--batang daun bawang--Secukupnya air--
Oseng-oseng tempe cabe hijau pedas mantabbb,papan tempe ukuran besar potong potong sesuai selera--buah bawang merah.--buah bawang putih--buah bawang bombay--batang daun bawang--gram cabe rawit hijau--buah cabe merah kriting--buah cabe rawit merah--buah tomat merah--sisir gula merah--secukupnya lada--secukupnya garam--minyak untuk menumis--sendok makan saori saus tiram--
Tempe lado kekinian,papan tempe daun--Tepung bumbu siap saji--Penyedap rasa--secukupnya Air--Daun bawang--Bumbu cabai :--Cabai rawit hijau--Cabai rawit jablay--siung bawang merah--siung bawang putih--
Tempe Goreng Telur,papan tempe--butir telur--tepung terigu--siung bawang putih (ulek halus)--Secukupnya merica dan kaldu bubuk--
Tempe bumbu kecap,secukupnya Tempe  (potong dadu)--lembar daun salam--secukupnya Kecap--Penyedap rasa--secukupnya Laos--secukupnya Air--bawang putih--bawang merah--kemiri--
Tempe mendoan,"papan tempe, potong sesuai selera. me:lebar dan tipis--tepung terigu--tepung beras--secukupnya daun bawang, cincang--secukupnya air--minyak untuk menggoreng--bumbu halus::::::::--buah bawang--ketumbar--secukupnya garam dan kaldu bubuk--"
Pecel kemiri tempe tahu kukus,Tempe--Tahu--cabe merah besar--cabe rawit (atau sesuai selera)--siung bawang putih--kemiri--buah tomat--Terasi--Gula--Garam--
Cilok isi tempe pedas manis,🍭Cilok:--tapioka--terigu--Sehelai daun bawang ambil bagian Hijaunya saja--secukupnya Air panas--🍭bumbu halus:--siung bawang putih--merica--🍭isian tumis tempe:--papan tempe potong dadu kecil--Cabai rawit merah secukupnya iris tipis--ebi--secukupnya Gula garam kecap--minyak--
Tempe isi Sambel,Tempe--Tepung bumbu ayam goreng krispi instan--sedikit Air matang--Minyak goreng--Bawang merah--Bawang putih--Tomat--Cabe rawit--Kemangi--Garam dan penyedap--
"Tahu, tempe, bihun kuah santan",papan tempe--buah tahu--ptg bihun jagung--btr kelapa--lbr daun salam--Bawang merah goreng--siung bawang putih--siung bawang merah--ruas jari kunyit--btr kemiri--ketumbar--garam--roico--Secukupnya Gula merah--
Oseng tempe pedas manis,"papan tempe (iris dan goreng setengah matang)--Bumbu:--butir bawang merah--siung bawang putih--buah cabai hijau--buah cabe rawit (sesuai selera)--buah tomat--Secukupnya garam, gula jawa dan kecap manis--Sedikit air--Minyak untuk menumis--"
Tempe Bawang Cabe Garam,papan tempe--bawang putih--cabe rawit merah--Daun bawang--Garam--Minyak (untuk menumis)--Tepung terigu--
🐓Ayam tempe goreng sambal balado🐔,potong daging ayam--ppn tempe potong kotakkecil lalu digoreng--buah jeruk nipis peras airnya--sesuai selera Gula dan garam--secukupnya Minyak goreng--siung bawang merah--siung bawang putih--buah cabe merah--buah cabe rawit--buah tomat ukuran sedang--Sejumput garam--
Tempe di cabein super simple,buah tempe daun--Sambal secukupnya (untuk sambalnya bisa liat di post aku sebelum--Minyak goreng untuk menggoreng--
Tempe Tepung isi sambal (Tempe Kekinian),papan tempe--batang daun bawang--batang daun seledri--bungkus sedang tepung tempe--Minyak goreng--Bahan sambal :--Cabai merah--Cabai rawit merah--Cabai hijau--siung bawang merah--siung bawang putih--secukupnya Garam--secukupnya Gula--Terasi (optional)--
Tempe mendowan,Bahan utama--papan besar tempe--Bahan adonan--munjung tp. Terigu--ketumbar butir--siung kecil bawang putih--ruas kunyit--Sedikit garam--kaldu bubuk--daun bawang potong--Seledri potong--Bahan lain--secukupnya Air dingin--
Oseng kacang panjang tempe,ikat kacang panjang--papan tempe--buah cabe rawit setan--buah cabe merah keriting--siung bawang putih--siung bawang merah--buah tomat--garam--gula merah--Secukupnya minyak goreng--Secukupnya air--
Baso tempe mercon,potong tempe (yg di sayur harga rban)--butir telur ukuran besar--tepung terigu--tepung kanji/tapioka--garam halus--lada bubuk--# bahan saus #--butir bawang putih--buah bombay besar--bji cabai merah (sesuaikan)--secukupnya daun bawang--lada bubuk--saos tiram--kecap manis--minyak secukupnya untuk menggoreng & menumis bumbu--
Oseng tempe buncis daging burger,"lembar daging burger potong""--plastik buncis potong"" (harga ribu kl ga salah)--papan tempe kecil potong""--secukupnya Cabe dan bawang putih--Minyak utk menumis--Royco sapi--"
Stik tempe,papan tempe (opsional)--tempw potong seperti stik--siung bawang putih--secukupnya ketumbar--secukupnya garam--penyedap rasa--tepung roti--
Kering tempe ala embu Abay,papan tempe iris tipis--butir bawang putih--butir bawang merah--buah cabai merah iris tipis / optional--batang serai--ruas lengkuas--lembar daun salam--biji asam jawa / diambil airnya saja--gula merah--gula pasir--garam--
Tempe Melet,papan tempe--bahan utk sambal--cabe rawit--cabe merah--bawang putih--tomat--penyedap rasa--bawang merah--bawang putih--kunyit--ketumbar--bahan utk tepung :--garam--tepung terigu--bawang merah--daun bawang atau seledri--penyedap rasa--
Oseng kecipir+tempe,"ikat kecipir--bks tempe potong dadu--sachet saos tiram--gelas air putih hangat atw panas dispenser--bks masako rasa ayam--butir bawang merah iris²--siung bawang putih geprek--butir cabe rawit,, bisa iris bisa butiran sesuai selera--"
Sambal goreng tempe kering,papan tempe potong --bumbu--buah cabe merah--siung bawang merah--siung bawang putih--lembar daun salam--lembar daun jeruk--lengkuas--secukupnya air--secukupnya air asam--secukupnya gula merah--secukupnya garam--secukupnya kaldu ayam--secukupnya minyak goreng--
"Ungkepan Ayam, Tahu, Tempe","papan tempe, potong--tahu Cina, potong kotak--ayam--※ Bumbu:--batang serai, memarkan--ruas jari jahe, memarkan--ruas jari lengkuas, memarkan--lembar daun salam--lembar daun jeruk--secukupnya Garam--secukupnya Lada bubuk--※ Bumbu halus:--siung bawang merah--siung bawang putih--butir kemiri--ruas jari kunyit--ketumbar bubuk--"
Daging Tahu Tempe Lada Hitam,daging tetelan potong-potong kecil--papan tempe--potong tahu putih--siung bawang bombay--siung bawang putih--sachet bumbu lada hitam--Secukupnya air--garam--kecap manis--gula--tepung maizena--
Semur Kari Tempe Tahu,"papan tempe (potong)--buah Tahu--lembar daun salam--batang serai (memarkan)--Secukupnya kecap manis (kecap B*ngo)--Secukupnya air--Secukupnya minyak utk menumis--Bumbu bubuk:--Secukupnya bumbu kari bubuk (saya merk koep*e)--Secukupnya garam,merica dan kaldu ayam bubuk)--siung bawang merah--siung bawang putih besar--butir kemiri--"
Tempe jelotot/tempe mercon/tempe jontor,"secukupnya Tempe--Potong agak tebal,sayat tengah unt dimasukan sambal isian--Sambal isian :--cabe rawit merah (aku bh)--cabe merah keriting (aku bh)--siung bawang merah--siung bawang putih--terasi--secukupnya Kencur--secukupnya Garam--Kulit/tepung :--bungkus tepung bumbu serbaguna sasa--tepung terigu--ketumbar bubuk--kunyit bubuk--secukupnya Garam--secukupnya Masako ayam--margarin (lelehkan)--btg daun bawang/seledri,iris tipis--secukupnya Air--"
Oblok-oblok tempe teri,papan tempe--teri--Petai cina / lamtoro--Daun bawang--ikat kemangi (siangi)--Tomat--siung bawang merah--siung bawang putih--buah cabe rawit (sesuai selera)--butir kemiri--buah terasi matang--Kencur--Daun salam--Lengkuas--Garam--Penyedap rasa--secukupnya Gula merah--
Tumis tempe kacang panjang,papan tempe potong dadu--lonjor kacang panjang--siung bawang merah--siung bawang putih--lembar daun salam--lengkuas--cabe merah--cabe rawit--Secukupnya saori--Gula--Garam--Royco--
Keripik tempe sagu,gram bakal tempe (berupa kedelai tapi sudah dicampur ragi)--gram tepung sagu / tapioka--siung bawang putih--ketumbar--garam/secukupnya--secukupnya Air--Plastik untuk membungkus tempe--
Oseng-Oseng tempe kacang panjang Pedas,papan Tempe potong kotak kecil--ikat Kacang Panjang potong--buah cabe merah--buah cabe rawit merah--butir bawang merah--butir bawang putih--buah tomat--lembar daun salam--ruas lengkoas--buah gula jawa--garam--kaldu bubuk--bungkus kecil terasi--mili Air matang--Secukupnya minyak kelapa untuk menumis--Secukupnya bawang goreng--
Sambel Tempe kemangi,bks tempe--cabe (sesuai selera)--siung bawang putih (digoreng)--Secukupnya daun kemangi--Secukupnya garam dan gula--
Tempe isi hot jelethot,Tempe--Cabai rawit/cabai hijau--Bawang merah--Bawang putih--Tomat--Gula--Garam--Penyedap--Daun bawang--Margarin--Tepung serbaguna--Minyak goreng--Sedikit air--
Tempe Menjos Cabai Hijau,Tempe menjos--Kacang tanah--Ikan teri--bumbu yang dihaluskan--Secukupnya cabai hijau--siung bawang putih--siung bawang merah--Secukupnya garam--Secukupnya gula pasir--
Orek Tempe Basah,Papan Tempe--Siung Bawang Putih--Siung Bawang Merah--Royco (selera)--Cabe Rawit (selera)--
Orek Tempe,"buah tempe, potong dengan bentuk korek api berukuran cm--ruas jari lengkuas, cuci bersih lalu memarkan--ruas sere memarkan--lembar daun salam--sendok makan kecap manis--minyak goreng untuk menggoreng tempe--Bahan yang dihaluskan:--gram cabe merah sebagian potong serong--buah cabe rawit--butir bawang putih--butir bawang merah--Secukupnya gula dan garam--air (gelas)--"
Tempe kecap pedas manis sederhana,papan tempe(aq beli nya yg harga rbuan)--buah cabe keriting + buah rawit(selera yg suka pedes)--siung bawang merah + siung bawang putih + butir kemiri--helai daun salam + helai daun jeruk--ruas lengkuas(aq skitar lah)--selera Kecap manis sesuaii--Minyak sayur untuk menumis--selera Gula garam + royco sesuaii--air putih--
Mendoan tempe gembus,buah tempe gembus--gram Tepung terigu--gram tepung beras--siung bawang putih--kunyit--Secukupnya ketumbar--secukupnya minyak goreng--Secukupnya merica--Secukupnya garam--Secukupnya air--
Tumis kangkung cumi asin plus tempe,"ikat kangkung--tempe (sesuai selera mau berapa banyak)--ekor cumi asin--siung bawang putih haluskan--siung bawang merah haluskan--cabe rawit(boleh skip kalo ngga suka pedes) haluskan--garam,merica--penyedap jamur (bila mau)--"
Tempe Terong Sambal Bawang,papan Tempe--buah Terong Ungu--Bumbu--siung bawang putih--siung bawang merah--biji cabe rawit--biji cabe merah keriting--buah Tomat--Lain-lain--Garam--Penyedap/mecin--Gula--Terasi--Minyak--
Balado Udang Tempe Simple,"udang tambak--papan tempe--buah cabai merah--buah cabai japlak (bisa dikurangi sesuai selera)--siung bawang putih--siung bawang merah--buah tomat--buah rampai--terasi abc (sedikit aja)--secukupnya Garam, kaldu bubuk, dan gula--"
Oseng tempe rasa daging,"bungkus tempe, potong dadu cm--Bumbu:-- cabai hijau iris-- bawang merah-- bawang putih-- lengkuas, memarkan-- gula pasir,--secukupnya  garam, penyedap--batang sereh, memarkan--kecap manis--Secukupnya minyak--"
Tempe melet maknyuuss,"Tempe gemuk (potong belah stengah)--tepung terigu--Kunyit--helai daun jeruk (sbgai pwangi)--Air scukup nya--Bahan sambal :--Cabai rawit (haluskan)--Cabai merah (haluskan)--Bawang merah (iris tipis)--Bawang putih (iris tipis)--Garam, royco (sesuai selera)--"
Tempe mendoan sambel kecap,"papan tempe, potong persegi tipis--tepung terigu--tepung maizena--batang daun bawang, iris--batang daun seledri, iris--Secukupnya kaldu bubuk (sy kaldu jamur totole)--ketumbar halus--Secukupnya air--Secukupnya minyak untuk menggoreng--siung bawang putih--ruas jari kunyit--Secukupnya garam--Sambel kecap ala ala saya :--buah jeruk sambel atau jeruk kunci yg kecil--cabe rawit, iris--bawang merah, iris--buah tomat, iris--Secukupnya kecap manis bango--"
Tempe Kecap Tumis Kacang panjang,"papan tempe potong dadu-- lenjar kacang panjang, potong memanjang--bumbu iris :--siung bawang merah--siung bawang putih--buah cabe hijau besar, potong serong--buah cabe merah besar, potong serong--buah cabe rawit hijau, potong serong--secukupnya air, garam, gula, merica, royco--secukupnya kecap--"
Tahu Tempe Bumbu Kuning,"biji tahu putih--papan tempe--buah kentang--biji cabe rawit (boleh lebih, sesuai selera)--batang daun bawang--secukupnya Taoge--Garam--siung bawang merah--siung bawang putih--ketumbar--Kunyit--secukupnya Minyak goreng--secukupnya Air--"
Pepes tempe/botok tempe,"papan tempe (aku disimpen hari terlebih dulu)--iket daun kemangi--siung bawang merah--siung bawang putih--buah cabe merah--buah cabe rawit (pedes nya sesuai selera)--Garam,gula,masako secukup nya--"
Cumi dan tempe asam manis pedas,"cumi--Tempe (sesuai keinginan)--buah tomat (potong dadu)--cabe merah besar (iris tipis)--cabe rawit (iris tipis)--lbr daun salam--ruas lengkuas--butir bawang merah (iris tipis)--butir bawang putih (iris tipis)--Minyak untuk menumis--Secukupnya air--Garam, gula, merica, totole, cabe bubuk--Saus sambal / saus tomat--"
Tempe goreng Chrispy,papan tempe--tepung maizena--tepung terigu--lada bubuk--ketumbar bubuk--penyedap rasa (bisa d skip)--Secukupnya garam--Secukupnya air--
Tahu tempe oseng kecap,Tahu--Tempe--Bawang merah--Bawang putih--Kecap--Garam--
Tempe Mendoan,"plastik Tempe, potong tipis-tipis--batang Daun bawang, iris tipis-tipis--mangkok Tepung terigu--Ketumbar--siung Bawang putih--bungkus Kaldu bubuk--Secukupnya Garam--Secukupnya Air--Secukupnya Minyak goreng--"
Mendol tempe,"papan tempe--tepung--ikat kemangi petik kuntum--Haluskan :--siung bawang putih--lbr daun jeruk--cabai rawit--sedikit Kencur--Garam, gula, penyedap--Minyak untuk menggoreng--"
Oseng tahu tempe mix wortel buncis,papan tempe potong dadu--tempe(ukurang kecil) potong dadu--buncis iris miring--wortel ukuran sedang iris persegi panjang--bawang merah (haluskan)--bawang putih (haluskan)--rawit merah (haluskan)--Secukupnya daun bawang--kecap--Secukupnya garam--
Kikil tempe cabe ijo,kikil--Tempe stengah--Bawang merah--Bawang putih--Jahe--bj Cabe ijo--Saori--garam--gula--kaldu--lada putih bubuk--ketumbar bubuk--
Oseng-oseng tempe gembus pedas manis #alamamakila,buah tempe gembus--siung bawang putih--siung bawang merah--buah cabe merah besar--buah cabe hijau besar--Kecap manis--Gula jawa--Gula pasir--Garam--Penyedap rasa (aku pakai ma**ko)--Minyak--
Tempe bacem,papan Tempe--siung Bawang merah--siung Bawang putih--Kemiri--Ketumbar--Garam (secukupnya)--Air kelapa/air biasa--Gula jawa (sesuai selera)--Kecap manis (sesuai selera)--Lengkuas (memarkan)--lbr Daun salam--Asam jawa--Minyak untuk menumis (opsional)--
Tempe isi cabe bawang goreng tepung,"tempe ukuran sedang--Secukupnya cabe,bawang merah,bawang putih--Secukupnya garam--Secukupnya minyak untuk menumis--Secukupnya adonan tepung. Aku pakai tepung bumbu instan--"
Nugget tempe mozarella,papan tempe (kukus menit)--buah wortel (parut)--batang daun bawang (iris halus)--munjung terigu--tepung maizena--telur ayam--Secukupnya keju quick melt--siung bawang merah--siung bawang putih--ketumbar--garam--lada bubuk--Bahan pencelup :--butir telur ayam--Secukupnya tepung panir--
Sambel tempe pete uleg,bungkus tempe--papan pete--bungkus terasi (saya pake abc)--cabe rawit (sesuai selera)--siung bawang merah--siung bawang putih--buah tomat--secukupnya Gula merah--secukupnya Garam dan gula--Penyedap rasa (optional)--
Bola-Bola Tempe,"papan tempe, rebus/kukus kemudian haluskan--butir telur puyuh/diganti bakso atau sosis (rebus telur)--Secukupnya tepung panir--butir telur ayam--Bumbu halus--siung bawah putih--merica--Secukupnya garam--Secukupnya penyedap--Minyak untuk menggoreng--"
Ungkep ayam dan tempe bumbu kuning,ayam bersihkan--papan tempe (potong potong)--lembar daun salam--lembar daun jeruk--batang serai (geprek)--ruas lengkuas--Bumbu halus--buah bawang merah--buah bawang putih--ruas kunyit--ruas jahe--ketumbar bubuk--Secukupnya--Garam--Penyedap rasa--
Bekal Suami - Burger Tempe Kornet Saus Asam Manis,Burger Tempe Kornet :--papan tempe uk. kecik--butir telur ayam--sachet  kornet (gram)--kaldu jamur--margarin--Secukupnya tepung panir--Saus Asam Manis :--sachet saori asam manis--bagian bawang bombay--saus tomat--saus cabai extra pedas--Secukupnya air--Secukupnya minyak goreng--Pelengkap :--buah telur ceplok goreng--Secukupnya sayuran rebus--Secukupnya potato wedges--
Tempe masak buncis,"papan tempe ukuran kecil-- buncis,cuci bersih iris serong panjang-- kecap manis-- saus tiram--lada bubuk--secukupnya Garam,gula--secukupnya Air-- cabe merah keriting-- btr bawang merah-- siung bawang putih--"
Tempe goreng gurih, papan tempe iris sesuai selera-- bawang putih--ketumbar-- kunyit--Secukupnya garam penyedap--
Tempe Mendoan Spicy," potong tempe-- tepung terigu-- air putih-- batang daun bawang,iris halus-- buah cabe rawit,iris halus--Bumbu Halus-- siung bawang-- siung bawang-- ketumbar-- butir kemiri--Kencur (seujung kuku)--Kunyit (seujung kuku,bakar)--"
Tumis tempe lenca cabe hijau, potong tempe ukuran . x . x  cm-- buah cabe hijau besar-- siung bawang merah-- siung bawang putih--bawang bombai-- santan kental dari butir kelapa-- g leunca-- ujung jari jahe-- kecap manis-- gula pasir-- lembar daun salam-- minyak kelapa klentik untuk menumis-- tangkai daun bawang--secukupnya Garam--
Steak Tempe, tempe-- tepung terigu-- tepung roti-- butir telur-- buah bawang bombay-- siung bawang putih-- saus barbecue-- ketumbar bubuk--secukupnya Garam dan lada--sesuai selera Sayur--Minyak goreng--
Bakso tempe simpel banget (ala anak kos)," papan tempe--tepung kanji--tepung terigu-- bawang merah-- bawang putih--Daun bawang, daun sledri--Bumbu kuah👇--Daun bawang, sledri-- bks penyedap rasa(aku pke royco rasa sapi)-- bks ladaku-- bks bumbu bakso--Sdikit garam dan micin--Bumbu sambel pedas👇-- cabe rawit-- bawang merah baput--Garam, micin--"
Orek Tempe Kecap," papan tempe, potong kotak-- siung bawang merah-- siung bawang putih-- buah cabe rawit (bisa di skip)--- kecap manis--Secukupnya penyedap rasa, gula dan garam--Minyak utk menggoreng tempe dan menumis bumbu--"
Nuget tempe&perkedel tempe dalam resep💓," tempe-- buah wortel(gr)->bisa skip--Telur butir(untuk adonan,untuk pelapis)--Minyak goreng--secukupnya Tepung panir--Bumbu halus👇:-- siung bawang putih-- siung bawang merah-- garam-- merica bubuk--"
Tempe isi cabe kriuk, papan tempe ukuran sedang-- sendok makan tepung terigu-- buah cabe rawit (sesuai selera)-- siung bawang putih-- siung bawang merah--sendok teh ketumbar-- lembar kecil daun jeruk--secukupnya Kunyit--secukupnya Garam dan penyedap rasa--
Peyek tempe, tepung beras-- munjung tepung tapioka--tempe dari tempe yang harga -- scht sun kara-- ketumbar-- garam-- air-- butir kencur atau sesuai selera--Secukupnya Royco--Secukupnya minyak goreng--
Tempe Telur Bacem, butir telur ayam (direbus dan dikuliti)--papan tempe (dipotong)-- siung bawang merah-- siung bawang putih-- buah kemiri-- ketumbar-- lembar daun salam-- buah gula merah (disisir)--Secukupnya garam dan gula pasir--Secukupnya air--
Tempe penyet sambel kemangi,papan tempe-- cabe rawit(sesuai selera)-- cabe keriting merah-- bawang merah-- bawang putih-- buah tomat--secukupnya kemangi--secukupnya jeruk nipis--garam dan gula--
Ulenan tahu tempe, lonjor tempe-- lonjor tempe-- bawang putih--garam--secukupnya Penyedap rasa--secukupnya Gula-- butih telur--
Tempe Jontor (Tempe isi) Kekinian, tempe ukuran sedang (potong potong)-- buah daun bawang-- bw merang-- bawang putih--merica bubuk-- tepung terigu-- buah cabe rawit merah-- ruas kencur--Gula dan garam (sesuai selera)--Penyedap--Secukupnya air--Secukupnya minyak--
Tempe Udang Lada Garam,sesuai selera Tempe dipotong-- buah udang-- siung bawang putih-- cabai kecil--secukupnya Garam dan lada--
Kering tempe teri kacang kriuk ala fe', bungkus tempe potong kecil-kecil-- sendok makan teri medan digoreng-- sendok makan kacang tanah digoreng--Minyak untuk menggoreng-- butir bawang merah-- siung bawang putih--Cabe merah keriting secukupnya (saya skip. Anak ga mau pedas)--Bumbu tidak dihaluskan :-- lembar daun salam-- lembar daun jeruk buang tulang-- butir asam kandis-- sendok makan gula merah / aren-- sendok makan gula pasir--sendok teh garam--jika suka Kaldu bubuk instan--
Tempe Orek Bumbu Uleg, papan tempe (potong kotak)-- biji cabe hijau (iris iris)-- kecap manis-- garam-- gula--Bumbu Halus : (di uleg)-- siung bawang merah-- siung bawang putih--buah tomat-- butir kemiri--ketumbar--
Kering tempe pedas manis, papan tempe--kacang tanah-- bungkus Air asam ( asam jawa matang+gelas air)--secukupnya Gula merah  (saya pke batok)-- cabe merah-- lmbr daun jeruk (iris kecil)--Masako-- siung bawang merah-- siung bawang putih-- cabe rawit (optional)--Lengkuas-- Gula pasir--Garam--
Perkedel tempe,"papan tempe semangit-- bawang merah-- bawang putih-- cabe merah-- cabe setan-- kencur-- lbr daun jeruk, iris tipis-- air-- btr telur--Secukupnya garam, lada, penyedap--"
Tempe mendoan Basah, papan tempe-- tepung terigu-- tepung sagu--Bumbu haluz-- siung bawang putih-- ketumbar-- siung bawang merah-- ruas kunyit--garam--merica bubuk-- lembar daun jeruk cincang--
