Title,Ingredients
Tempe tepung goreng, papan tempe potong tidak tebal tidak tipis-- terigu apa saja--secukupnya daun bawang/bawang prei--sejumput ketumbar-- siung bawang putih--penyedap ayam--Secukupnya garam--secukupnya gula--minyak untuk menggoreng--secukupnya air--kunyit bubuk (bisa pake bisa jg engga ya) me: engga pake--
Steak tempe saus BBQ, papan tempe-- ons Tepung terigu-- Tepung maizena-- buah tomat-- cabai rawit (optional)-- bawang bombay-- bawang putih-- kecap manis-- saus BBQ--Lada--Garam--Gula--Penyedap rasa--
Santan tempe kacang, batang tempe-- ikat kacang panjang( tangkai)-- bks santan kara--bumbu halus-- cabe merah besar-- cabe rawit-- kunyit-- jahe-- buah kemiri-- bamer-- baput--bumbu kasar-- lengkuas(geprek)-- batang serai-- lembar daun salam-- bks masako ayam-- micin-- gayung air--
"Oseng Kacang panjang,kol dan Tempe Simple",Kacang panjang--Kol--papan tempe-- siung bawang merah-- buah cabe merah kriting-- buah cabe rawit setan-- lengkuas geprek-- lembar daun salam--secukupnya Garam--secukupnya Penyedap rasa (Sasa)--terasi--Minyak untuk menumis--
Tempe wangi daun kemangi bumbu kuning, papan tempe-- ikat daun kemangi (optional bisa ditambahi sesuai selera)-- bumbu jadi rasa kare(saya pake bumbu jadi krn lg mls ngulek)-- lembar daun jeruk--Secukupnya laos--Sedikit jahe-- batang sere-- ruas Kunyit (sya tmbhi kunyit biar warna kuningnya smkin nyala)-- buah cabe rawit (optional sesuai selera)--Secukupnya garam--Secukupnya gula--Minyak untuk menumis--
Tumis Tahu Tempe, kotak Tempe-- buah Tahu -- siung Bawang Merah-- siung Bawang Putih-- Cabe Merah-- lbr Daun Bawang--Secukupnya Gula--Secukupnya Penyedap Rasa (Royco)-- Sachet Kecap Manis (Bango)--sedikit Air--
Ayam Tempe Kecap, ayam /  potong ayam (uk potong )--papan tempe-- buah cabe hijau besar-- siung bawang merah-- kecap manis--Garam-- siung bawang putih-- kunyit-- saus tiram-- minyak wijen--
Tempe Mendoan,papan tempe-- tepung terigu-- tepung beras-- btg daun bawang--Garam--bgks kaldu ayam--
Oseng tempe dan kacang panjang, btng kacang panjang-- udang ukuran sedang--papan tempe--Bumbu iris :-- siung bawang merah-- siung bawang putih-- cabe hijau (iris serong)--Seiris lengkuas-- kecap manis--Garam--Gula--lada bubuk--Kaldu bubuk--
Mendol tempe simple, papan tempe (uk sedang)-- tepung kanji (tapioka)--Bumbu halus-- siung bawang merah-- siung bawang putih-- biji cabe rawit (sesuai selera)-- ruas kencur-- lembar daun jeruk--secukupnya Gulai--secukupnya Garam--
Tempe jengkol balado, papan Tempe--Jengkol--secukupnya Air--Minyak untuk menumis--Bumbu halus--Cabe rawit merah--Bawah putih--Bawang merah--Ketumbar--Tomat--Royko ayam--Gula putih--Semua di ukur sesuai byknya quantity yg akan kita masak ya--
Tempe Mendoan, papan tempe-- ikat daun bawang dan seledri-- butir bawang putih-- ketumbar bubuk-- merica bubuk-- tepung terigu--Secukupnya garam--Minyak untuk menggoreng--Secukupnya air--
Tumis Kacang Panjang Tempe," buah kacang panjang--papan tempe (goreng sebentar/tidak)--Lengkuas (geprek)-- buah tomat (potong - sy gak pake)--secukupnya Garam, gula, penyedap rasa-- siung bawang merah-- siung bawang putih-- buah cabe merah kriting--"
Mendol Tempe, kotak tempe kemaren-- kotak tempe baru-- bawang merah besar-- bawang putih besar-- cabe merah besar-- cabe rawit (sesuai selera)-- ketumbar bubuk-- ruas kencur-- daun jeruk--gula pasir-- garam-- kanji--Secukupnya Royco sapi (boleh di skip)--Secukupnya minyak goreng untuk menggoreng--
Tempe bumbu kencur," lempeng tempe, potong kotak-- cabe rawit merah-- cabe merah keriting-- kemiri-- siung bawang putih-- siung bawang merah-- ruas jari kencur-- kecap manis-- santan kara--Garam, lada, gula pasir, penyedap rasa--Minyak goreng--Daun salam--"
Tempe bacem istimewa," tempe,aq beli--bumbu halus-- bawang merah-- bawang putih-- cabe rawit domba--Secukupnya asem--secukupnya penyedap--secukupnya gula pasir--secukupnya garam--secukupnya kecap manis--sedikit air matang--"
"Tempe,kacang kering"," papanTempe diiris,digoreng kering--kacang tanah digoreng-- biji bawang merah-- biji bawang putih-- kecil buletan gula merah-- biji Cabe rawit merah diiris-- Lengkuas digeprek-- lembar daun salam-- Air asam jawa-- buletan kecil gula merah--"
Tumis toge + kacang panjang + tempe,Seikat kacang panjang--Toge--papan Tempe--Bumbu:--Bawang bombay-- siung Bawang merah-- siung Bawang putih--sesuai selera Cabe--sesuai selera Garam--sesuai selera Gula pasir--Saos tiram--sesuai selera Kecap--
Tempe kering basah no penyedap, papan tempe sudah putih --Bumbu  :-- bawang merah-- bawang putih-- cabe rawit-- cabe merah-- lembar daun salam--Se iris lengkuas--gula jawa bulat--Minyak--
Perkedel tempe simple," papan tempe-- siung bawang putih-- siung bawang merah-- batang daun bawang-- batang seledri-- butir telur--Sekucupnya garam, lada bubuk, dan penyedap rasa--"
Tempe asam manis pedes, bungkus kecil tempe-- buah cabe merah kriting-- buah cabe rawit merah-- siung bawang merah-- siung bawang putih-- sendok teh Asam jawa-- buah gula merah--garam halus--Seruas ibu jari lengkuas-- lembar daun jeruk--Minyak utk menggoreng--
Tumis buncis tempe bosok,Sebungkus buncis--tempe yang sudah - hari-- bawang merah-- bawang putih-- lembar daun salam-- bungkus penyedap rasa optional (magic)--secukupnya Garam--secukupnya Kecap manis-- Air matang--Minyak--
Tempe Penyet ala Kampung Halaman, buah tempe ( rupiah)--Bumbu Sambal:-- buah cabai rawit (sesuai selera)-- buah tomat-- siung bawang merah-- siung bawang putih--secukupnya Terasi--gula pasir--Secukupnya garam--Minyak goreng untuk menggoreng dan menumis--Untuk bumbu tempe:-- siung bawang putih-- kunyit--Secukupnya ketumbar--Garam--Tambahan:-- buah Mentimun--Beberapa lembar daun kemangi--
Tempe Kere 😋," potong tempe goreng-- cabe merah besar--sesuai selera Cabe rawit-- siung bawang putih-- ruas kencur--terasi aq pk yg sachet kecil--gula pasir--Garam sdkit,--bila suka Penyedap--"
Tahu Tempe Bacem," papan tempe-- buah tahu-- lengkuas, geprek-- Lembar daun salam-- keping gula merah disisir-- kecap manis--secukupnya Garam dan air-- siung bawang merah-- siung bawang putih-- ketumbar bubuk, sangrai--"
Oseng orak arik tempe worken, biji Kentang-- biji Wortel uk sedang-- papan Tempe-- Bawang putih-- Bawang merah--Gula putih/merah (sesuai selera)--Kecap manis--Garam/royco--Merica--
Bakwan Tempe, buah tempe-- batang daun bawang-- bungkus tepung bakwan kecil-- air matang--minyak untuk menggoreng--
Oseng Tempe Jamur plus Sayuran," lonjor kacang panjang-- helai daun kol--buah jagung manis-- iris tempe--bungkus jamur kancing--💠 Bumbu 💠-- butir bawang merah-- siung bawang putih-- buah cabe hijau-- buah tomat sayur-- potong kecil lengkuas--batang serai-- lembar daun salam-- lembar daun jeruk--secukupnya garam, gula pasir & merica bubuk--secukupnya penyedap rasa (jika suka)--"
Empis empis tempe temanggung,potong Tempe-- biji Bawang putih-- biji bawang merah-- biji cabai keriting hijau (saya pakai campur)--Laos--Salam--Serei--Jahe--Garam--Gula merah--Kecap--
Tempe terong buncis bumbu kecap, buah tempe ribuan-- batang buncis-- terong ungu-- siung bawang putih-- siung bawang merah-- ruas jahe--Secukupnya penyedap--Secukupnya kecap manis--Sedikit air--Minyak goreng--
Tempe Mendoan,"Secukupnya tempe potong tipis-- tepung terigu-- tepung beras-- siung bawang putih besar (kalo kecil )--, kunir-- ketumbar bubuk--Secukupnya garam--Secukupnya penyedap--Secukupnya air--Secukupnya daun bawang, daun jeruk, daun kemangi potong tipis--Secukupnya Minyak goreng--"
Tumis Tongkol Suwir Tahu Tempe," buah tongkol ukuran sedang (digoreng kemudian disuwir suwir)-- tahu (dipotong"" terus digoreng)-- tempe (dipotong"" terus digoreng)-- siung bawang putih (dicincang)--bawang bombai (dicincang)-- ruas lengkuas (digeprek)-- lembar daun salam-- lembar daun jeruk-- cabe rawit (cincang)-- cabe merah (cincang)--secukupnya Garam--secukupnya Gula--secukupnya Merica--secukupnya Kecap--secukupnya Air--"
Tempe mendoan kriuk, papan tempe-- terigu-- ketumbar-- ruas kunyit-- siung bawang putih-- garam-- batang daun seledri (diiris)--secukupnya Air--
Tumis tempe tahu kerang, papan tempe-- papan tahu--Secukupnya kerang--Bumbu (cincang)-- siung bawang merah-- siung bawang putih-- cabe merah--Cabe rawit (sesuai selera)-- lengkuas geprek-- jahe geprek-- buah tomat-- lembar daun salam--secukupnya Kecap manis-- Saori saus tiram--Gula--Garam--
Oseng Tempe Buncis, tempe yang beeukuran besar-- cabe rawit-- siung bawang putih-- siung bawang merah-- lembar daun salam-- ruas laos-- daun jeruk--secukupnya garam--secukupnya gula jawa--penyedap / aji no moto--beberapa buncis--kecap--
Gulai ikan mas n tempe,"ikan mas--papan tempe...potong potong sesuai selera-- bks santan KARA yang ml..karna sya males parut kelapa.-- lbr daun salam-- lbr daun jeruk-- btang sereh-- lengkuas--bumbu halus-- cabe merah besar,kalo suka pedas boleh di tambah-- siung bawang merah-- siung bawang putih--ketumbar..boleh bubuk boleh yg biji'n--pala bubuk..kalo gk suka boleh skip-- butir kemiri-- jahe-- kunyit--secukupnya gula garam dan penyedap--minyak goreng--"
Pangsit Goreng isi Tempe & Sayur, buah tempe (ukuran disesuaikan y moms)-- butir telur ayam-- buah wortel (potong dadu)-- buah buncis (potong biasa)--Penyedap masakan (saya pake r*yc* ayam)--Garam (secukupnya)--Kulit Pangsit (saya pake yg udah jadi y 😉)--
Tempe Penyet,papan tempe--bumbu tempe:-- siung bawang putih--secukupnya garam-- ketumbar--bumbu sambal:-- buah cabe merah-- buah cabe rawit oren/hijau-- siung bawang putih-- siung bawang merah-- buah tomat--secukupnya garam dan gula--minyak sayur--
"Semur telur, tempe dan kentang by:: Mohmoy 😘","telur ayam ( telur ayam)-- papan kecil tempe (potong selera)-- kentang (potong bagi jadi )--🔪bumbu🔪-- siung bawang merah (haluskan)-- siung bawang putih (haluskan)--tomat merah-- bji kemiri (sangrai (tidak juga gpp,selera)--secukupnya garam--kecap manis--secukupnya gula putih--penyedap rasa--secukupnya minyak goreng--lada sekucupnya--"
Tempe tepung goreng, balok tempe yg udah dipotong tipis (sesuai selera)-- tepung terigu-- Bawang putih giling--Secukupnya air--Secukupnya garam--
Kering tempe praktis ekonomis, papan tempe potong korek api-- daging ayam-- siung bawang putih-- siung bawang merah-- laos-- lembar daun jeruk-- batang serai-- lembar daun salam--secukupnya Garam--secukupnya Gula jawa--secukupnya Kecap manis--secukupnya Minyak goreng--secukupnya Air--
Tempe goreng simple, ptg tempe--secukupnya Terigu--Garam dan penyedap rasa--Bawang putih--
Sambel Tempe," potong tempe (goreng)--secukupnya minyak untuk menggoreng--secukupnya garam, gula, dan penyedap-- siung bawang putih-- kecil bawang merah-- cabai merah keriting-- cabai rawit + cabai rawit merah (sesuai selera)--"
PeTang (temPe kenTang) Balado, buah kentang--papan tempe--Cabe--Bawang merah--Bawang putih--Garam--Minyak goreng--
Tempe manis laos / lengkuas, papan tempe-- siung bawang merah-- siung bawang putih-- potong besar laos-- gula pasir--secukupnya Garam-- air asam jawa--
Tempe mendoan kremess," tempe mendoan(isinya jdi )  bungkus tempe isinya -- ranjang daun bawang-- butir telur--tepung terigu, bisa di kurangin klo kebnyakan--Scukupnya tepung tapioka--Bumbu racik(adonan kremesan) bisa skip--Scukupnya ketumbar--Garam--Lada--Bumbu kaldu ayam scukupnya saja--Scukupnya air--Minyak goreng--"
Oseng tempe pedas manis," papan tempe, potong dadu. goreng hingga kering-- siung bawang merah-- siung bawang putih-- buah cabai merah-- buah cabe rawit, bisa di tambah jika ingin pedas-- kecap manis-- saus tiram--secukupnya minyak goreng--secukupnya gula dan garam (aku nggak pernah pake penyedap)--"
Tongseng sawi putih + Tempe bacem,potong tempe bacem--secukupnya Sawi-- siung bawang merah-- siung bawang putih--sesuai selera Cabe-- buah tomat-- gelas air putih-- kemiri-- sendok gula + garam--secukupnya Penyedap rasa masako--
Tempe goreng selimut,papan tempe-- Batang daun bawang (me:daunnya saja)-- tepung terigu--secukupnya garam--secukupnya air-- ketumbar-- siung bawang putih-- butir kemiri--
Tumis pedas tempe bakso,papan tempe-- butir bakso sapi-- lonjor kacang panjang--Bawang bombai-- kecap manis--Bumbu yg dihaluskan :-- siung bawang merah-- siung bawang putih-- buah cabe merah kriting-- buah cabe rawit-- butir kemiri--Garam--Kaldu jamur--
Orek Tempe, papan tempe-- siung bawang merah-- siung bawang putih-- lembar daun salam-- batang sereh-- buah gula jawa-- buah cabe kriting-- buah cabe rawit--Secukupnya air--Secukupnya minyak goreng--Secukupnya penyedap rasa (saya masako)--
Tempe pedas manis, papan Tempe potong dadu-- lbr daun salam-- btg sereh geprek-- kecap manis-- Air--Pete iris secukupnya-- cabe rawit-- cabe merah besar-- tomat merah-- trasi goreng/bakar-- garam-- kaldu bubuk-- gula--
Pepes Tempe," cabe ijo, iris serong-- Tempe,iris,haluskan--(Saya haluskan dengan cobekan)--secukupnya Daun kemangi-- tomat merah,potong-potong--secukupnya Garam--Daun pisang untuk membungkus-- kencur-- siung bawang putih-- siung bawang merah-- buah cabe merah keriting--Ketumbar Bubuk----"
Perkedel Tempe, buah tempe panjang-- butir telur ayam-- siung bawang putih-- siung bawang merah (digoreng)--merica-- tepung terigu--Secukupnya garam dan gula pasir--Secukupnya daun seledri--Secukupnya tepung terigu untuk balutan--Secukupnya putih telur untuk balutan--Secukupnya minyak goreng--
Bandeng presto + tempe bumbu bali," ekor bandeng presto-- papan tempe-- ruas lengkuas (geprek)-- lembar daun jeruk (remas)-- batang serai--lada bubuk--secukupnya Garam, gula, royko ayam-- air-- cabai keriting merah-- cabai rawit-- bawang merah-- bawang putih-- kemiri--jari kunyit--ketumbar--"
Orek tempe tahu, papan tempe-- buah tahu coklat-- bungkus ebi--Secukupnya kecap bango--gelas belimbing air putih-- siung bawang merah-- siung bawang putih-- buah cabe jablay-- buah cabe rawit--Secukupnya garam--potong gula jawa--Secukupnya merica bubuk-- lembar daun jeruk (optional)--
Tempe Geprek Enak, buah tempe daun-- siung bawang putih-- cabe rawit--secukupnya Garam--secukupnya Ketumbar--
Tumis Tempe Kacang Kemangi, papan tempe kacang-- ikat kemangi-- siung bawang putih-- buah cabe rawit-- ruas lengkuas geprek--secukupnya Udang rebon--Minyak untuk menumis--secukupnya Gula--secukupnya Garam--secukupnya Merica--
Tumis Tempe Kacang Panjang,Bahan :-- Papan tempe (potong-potong)--Segenggam kacang panjang (potong memanjang)-- Lembar daun salam-- lengkuas (memarkan)-- gula merah serut--secukupnya Kecap manis--Sedikit terasi bakar--secukupnya Garam--secukupnya Air--Minyak untuk menumis-- siung Bawang merah (iris halus)-- siung Bawang putih (iris halus)-- Cabe merah keriting (iris serong)-- Cabe ijo besar (iris serong)-- Cabe rawit oren (iris serong)--
Bindol tempe khas banyuwangi, lonjor tempe iris tipis tipis-- batang serai iris tipis tipis-- siung bawang merah-- siung bawang putih-- cabe merah besar-- cabe rawit (sesuai selerah)-- ruas lengkuas iris tipis--royko-- jumput kanji--
Cookies Tempe," tepung terigu-- susu bubuk-- munjung coklat bubuk-- gula halus-- butir kuning telur-- butter-- tempe, parut dengan parutan keju--secukupnya Wijen--"
Tempe goreng tepung, Papan tempe--Daun bawang & seledri--secukupnya Air dingin--sesuai selera Cabe rawit--
Udang tempe oseng kecap,udang (buang kepala)-- papan tempe (potong dadu)-- buah tomat (potong dadu)--Secukupnya lombok kecil/cabe rawit (iris serong)--Secukupnya lombok ijo+ale (iris serong)-- siung bawang putih (iris tipis)-- siung bawang merah (iris tipis)-- bks masako sapi-- sachet kecap bango--Sedikit air--Minyak goreng--
Sarden Masak Tempe Cabe Hijau Sayur,potong dadu Tempe-- siung bawang putih iris tipis-- siung bawang merah iris tipis-- buah cabe hijau besar potong tipis menyamping-- garam--gula-- buah tomat potong dadu-- buah wortel potong melingkar tipis-- botol sarden (saya menggunakan merk kingfish balado)-- minyak goreng-- ruas daun bawang-- air--
Mbes mbes tempe Banyumasan," papan tempe(potong"" tebal  cm)-- ptg lengkuas geprek-- btg serai geprek-- lbr daun salam--Secukupnya gula--Secukupnya garam--Secukupnya kecap--Secukupnya kaldu bubuk--Secukupnya air putih--Bumbu halus-- bawang merah-- bawang putih--ketumbar--merica-- btr kemiri-- kunyit goreng sebentar--"
Kering Tempe, papan tempe-- ons kacang tanah-- siung bawang putih-- siung bawang merah-- butir merica-- buah kemiri-- buah gula merah ukuran kecil (di sisir)-- lembar daun salam-- lembar daun jeruk-- ruas lengkuas memarkan-- tangkai serai (ikat memarkan)--Secukupnya garam dan penyedap (boleh skip sesuai selera)--
Sambal Tempe Enak, buah tempe--Sambal:-- buah cabai merah-- buah cabai rawit-- buah tomat merah-- siung bawang merah-- siung bawang putih--Secukupnya Kencur (dikit aja ya)--Secukupnya terasi (digoreng bentar aja)--Secukupnya garam dan gula--
Tempe penyet sambal kemiri, papan tempe--garam-- butir bawang putih-- ketumbar--Secukupnya air--Bahan untuk sambal-- butir bawang merah-- butir bawang putih-- cabai mercon-- cabai merah--terasi ABC-- butir kemiri-- buah tomat--Secukupnya minyak goreng--Secukupnya gula merah--Secukupnya garam--
"Telur, Tempe, Tahu Bumbu Bali"," butir telur ayam rebus-- papan tempe, goreng-- buah tahu, goreng-- siung bawang merah-- siung bawang putih-- buah cabe merah besar/keriting (buang bijinya)-- buah cabe rawit (sesuaikan dg level pedas yg diinginkan)-- butir kemiri-- ruas jahe--Secukupnya kecap manis--Secukupnya gula & garam--"
Lodeh Tempe dan Sayuran (pedas),"Isi Lodeh:--papan tempe ukuran sedang-- untai kacang panjang-- wortel--kol-- tomat--Potong bahan isi sesuai selera---- ruas jari lengkuas, digeprek-- lembar daun salam, remas-- lembar daun jeruk, remas-- bks santan kara kecil-- gula merah-- garam--secukupnya Minyak dan air---- siung bawang merah-- siung bawang putih-- cabe merah besar-- cabe rawit merah-- butir kemiri-- ketumbar-- ebi kering--"
Tempe Mendoan Kucai, buah tempe-- ikat daun kucai--Secukupnya tepung terigu--Secukupnya minyak goreng--Bumbu:-- siung bawang putih--ketumbar-- lembar daun jeruk--Secukupnya kunyit--Secukupnya garam--Secukupnya air--
Sambal Tempe #pr_homemadestreetfood, papan tempe ukr kecil--Minyak u/ menggoreng--secukupnya Garam--secukupnya Air--Ulek:--garam-- siung bawang putih-- buah cabai rawit--
Tumis kacang panjang tempe pete,"ikat kacang panjang, potong sesuai selera-- buah tempe potong, iris panjang-panjang-- buah pete, potong menjadi bagian-- buah cabe keriting, iris serong-- buah cabe rawit merah, iris serong-- siung bawang merah, iris tipis-- siung bawang putih, iris tipis--Lengkuas, digeprek-- buah daun salam--secukupnya Saus tiram, gula pasir dan minyak goreng--"
Tempe Silet ala wien," papan tempe ukuran besar--🌻 bumbu halus :-- siung bawang putih (uk.besar)-- siung bawang merah (uk.sedang)--Secukupnya ketumbar dan kemiri--🌻 bahan pelengkap :-- tepung beras-- tepung maizena--Secukupnya air, garam, royco (optional)--"
Teri tempe sambal bawang iris simple," ons teri jengki/medan goreng matang (me : teri jengki putih)-- papan/gr tempe (potong dadu,goreng matang)--- siung bawang merah (iris)-- pcs cabai keriting merah (haluskan)-- pcs cabai rawit merah (haluskan)-- btg daun bawang iris +/-cm (bisa di skip)-- garam--gula pasir--kaldu bubuk-- minyak goreng--"
Tempe Crispy, papan kecil tempe-- gram tepung terigu-- sendok tepung kanji-- sendok tepung beras-- butir telur--Garam--Penyedap rasa--Ketumbar--Bawang putih--Merica bubuk-- Air--
Tempe goreng gundul 😂😂, papan tempe--Bumbu halus ⏬-- siung bawang putih-- ketumbar-- butir kemiri--secukupnya garam--
Tempe mendoan, g terigu-- tapioka-- tepung beras--Tempe (aku pake yg panjang diptg)--Air secukpnya--Daun bawang iris kecil(aku banyak)--Irisan cabe dlm adonan (opsional)--Garam/gula/penyedap--Bumbu balus:-- siung bawang putih-- jempol kunyit-- ketumbar--
Tumis kangkung sambal tempe, ikat kangkung--Secukupnya saos tiram--Penyedap-- air--Bumbu ulek:-- siung bawang merah-- siung bawang putih-- buah cabe keriting--potong tomat-- garam-- potong tipis tempe--
Tempe Goreng Tepung," papan tempe, iris tipis-- tepung terigu-- tepung beras-- btg daun bawang, iris tipis--Secukupnya bawang putih bubuk--Secukupnya garam & royco--Secukupnya air--Secukupnya minyak utk menggoreng--"
Tempe Gembos Super Kriuk!," papan tempe gembos, potong sesuai selera-- kunyit bubuk-- oregano (bisa pakai seledri segar plus daun bawang mom)--garam-- tepung terigu--secukupnya air--✨ Bumbu Halus-- siung bawang putih-- ketumbar bubuk--"
Tempe Goreng Praktis, papan tempe mentah-- siung bawang putih-- sendok teh ketumbar--secukupnya penyedap rasa--secukupnya air--secukupnya minyak goreng--
Telur Tempe Bumbu Bali, butir telur-- bungkus Tempe--#Bumbu halus#-- siung bawang putih-- Siung bawang merah-- Buah cabai rawit merah-- buah tomat--Gula putih-- ruas jahe-- lembar daun jeruk-- kecap bangau-- santan kara-- liter air--
Tempe selimut terigu dan soto ayam sealakadar,"ayam (aku pakai fillet)--Sayuran(wortel,daun bawang, kentang, toge)--sereh, daun jeruk-- siung bawang merah-- siung bawang putih-- biji kemiri--Spotong kunyit--Spotong jahe--secukupnya Garam--secukupnya Gula pasir--"
Tempe selimut terigu,Stengah potong tempe--Terigu kriuk tempe (optional)--Terigu--Daun bawang--
Tempe orek, papan tempe-- sachet kecap manis-- pcs gula merah--Cabe merah-- siung bawang merah-- siung bawang putih-- siung bawang bombay--
Sambal balado kentang campur tempe, gram kentang (iris sesuai selera)-- papan tempe (iris sesui selera)-- lengkuas (geprek)-- lembar daun salam-- lembar daun jeruk--☘ bumbu halus ☘-- butir bawang merah-- butir bawang putih-- biji cabe keriting-- biji cabe rawit (super pedas)-- butir tomat besar--
Botok kemangi tempe biji lamtoro," gram biji lamtoro,cuci-- potong tempe,kukus,penyek pakai tangan-- ikat kemangi,siangi,cuci bersih--butir kelapa setengah tua,parut kasar--Secukupnya belimbing wuluh(sy skip krn g ada)--Secukupnya daun-- siung bawang putih,goreng hingga harum-- siung bawang merah,goreng hingga harum--ketumbar bubuk-- buah cabe rawit,sesuaikan sel-- lembar daun jeruk-- gula,sesuaikan selera-- bks masako ayam--"
Sambal tomat tahu tempe, petak tahu-- bungkus tempe ukuran sedang--wortel--Bahan bumbu :-- buah cabe merah-- siung bawang merah-- siung bawang putih--buah tomat--Garam--Gula--
Oseng Jamur Kentang Tempe, bungkus jamur tiram--papan tempe-- buah kentang uk kecil--Bumbu:-- siung bawang merah-- siung bawang putih-- buah cabe rawit-- butir kemiri-- jahe-- ketumbar bubuk--kunyit bubuk-- saus tiram-- batang daun bawang--- kecap manis--Secukupnya garam--Secukupnya air--Secukupnya minyak--
"Tahu,kentang,tempe kecap bbu simple", buah tahu(potong sesuai selera)--ppn tempe(potong sesuai selera)-- buah kentang (potong sesuai selera)--secukupnya Kecap manis--secukupnya Kaldu bubuk ayam--secukupnya Garam--secukupnya Lada bubuk--secukupnya Air--secukupnya Minyak sayur--Bbu halus:-- siung bawang merah-- siung bawang putih-- btr kemiri--
Steak tempe,"papan tempe (kukus lalu haluskan)--bungkus lada putih-- butir telur-- siung bawang putih (haluskan)--Penyedap rasa-- terigu--Utk sayuran :--Secukupnya buncis--Secukupnya wortel--Kukus keduanya hingga matang--Secukupnya kentang, goreng--Bahan saus :-- maizena (beri air)--Secukupnya saori saus tiram--secukupnya Air--Dan bawang bombay (iris halus)--"
Orek tempe basah," papan tempe,potong kotak-- batang sereh,geprek-- lengkuas,geprek-- buah cabe hijau besar,iris serong--Bumbu yang di haluskan:-- siung bawang merah-- siung bawang putih-- buah cabe merah keriting-- gula merah,sisir-- kecap manis--Secukupnya gula,garam--Secukupnya penyedap(optional)--"
Kering Tempe Kacang Legit Gurih, papan tempe (iris kecil-kecil)-- kacang tanah goreng-- gula jawa-- siung bawang putih-- siung bawang merah-- buah cabai merah-- lembar daun salam-- lengkuas-- mata asam jawa-- garam-- air matang--Minyak goreng--
Bali Tahu Tempe," kotak tahu putih ukuran kecil, goreng matang--papan tempe, goreng matang-- siung bawang merah, iris tipis-- gula merah-- buah tomat, iris-- kecap manis--secukupnya Gula--secukupnya Garam--secukupnya Air--🔷Bumbu halus:-- siung bawang putih-- siung bawang merah-- buah cabe keriting-- buah cabe merah besar-- ruas jahe-- ruas kencur--"
Steak tempe maknyus dengan modal rb,Bahan steak :--papan Tempe-- Terigu-- siung Bawang putih-- Merica bubuk-- Garam-- Royco--Bahan bumbu :-- siung  Bawang putih iris lembut--Bawang bombay iris kasar--Saus tomat--Saus cabai--  Tepung kanji dicairkan--Saos tiram--Kalo yang suka pedes bisa pake irisan cabe merah-- Garam-- Royco--sedikit  Gula gak pake juga gpp-- merica--Bahan topping :-- Wortel-- biji  Buncis-- Jagung manis--
Tempe goreng ala fe', bungkus tempe malang diiris  bagian-- sendok teh garam--sendok teh ketumbar bubuk-- bawang putih ulek halus--air secukupnya sesuai selera--
Nugget tempe, bungkus tempe-- tepung roti-- tepung terigu-- butir telur-- siung bawang putih--Merica--secukupnya Garam--Bahan balutan:-- gram tepung roti-- tepung terigu--secukupnya Air--
Tempe Menjes.. #pr_homemadestreetfood, papan ( gr) tempe menjes-- tepung segitiga-- tepung beras--Air es secukupnya ( ml)-- siung bawang putih-- ketumbar-- kunyit yang tua-- lembar daun jeruk--secukupnya Garam gula/kaldu bubuk--
Sayur tempe kacang panjang telur puyuh, papan tempe iris kotak goreng setengah matang-- ikat kecil kacang panjang-- butir telur puyuh rebus-- butir bawang merah iris tipis-- butir bawang putih iris tipis-- cabai hijau-- cabai merah--secukupnya Kecap manis--secukupnya Gulgarmer--
Ikan Mas Tempe semangit ala Kham, atau  ekor ikan mas--  tempe semangit atau busuk-- siung  bawang merah-- siung  bawang putih--  cabai besar--  cabai rawit--gula dan penyedap rasa--  Jahe--Santan kelapa atau kara--secukupnya Air--
Oseng Labu Siam dan Tempe, buah labu siam--tempe blok-- buah cabe merah panjang-- buah cabe rawit-- siung bawang merah-- siung bawang putih-- sendok makan saus tiram--secukupnya garam--secukupnya gula--secukupnya air--minyak goreng--
